parent_comment_id,comment_id,comment_time,comment_user_name,comment_user_link,comment_content,comment_like_num,child_comment_num
,4795739966801548,Wed Jul 27 07:09:31 +0800 2022,天大金子涵,https://weibo.com//u/6347767535,"终于有人说了我说不出来的感受<img alt=""[苦涩]"" title=""[苦涩]"" src=""https://face.t.sinajs.cn/t4/appstyle/expression/ext/normal/7e/2021_bitter_org.png"" />",1,1
4795739966801548.0,4795759373058294,Wed Jul 27 08:26:37 +0800 2022,YSternpccccc,https://weibo.com//u/5847679447,能把这种事当赞歌的人根本就是过得太好，连我们做普通人的苦都没吃过，怎么可能共情更深的苦,0,0
,4795706445398037,Wed Jul 27 04:56:18 +0800 2022,--DEFEAT--,https://weibo.com//u/3183760553,xx自己的不作为却转移视线到底层的手段╮(╯▽╰)╭,0,1
4795706445398037.0,4795734215624533,Wed Jul 27 06:46:40 +0800 2022,YSternpccccc,https://weibo.com//u/5847679447,甚至也可以歌颂，唯独不能说这是现代人的一剂良方，冷血又不善良,0,0
,4795649129712748,Wed Jul 27 01:08:34 +0800 2022,YSternpccccc,https://weibo.com//u/5847679447,想起来这种感觉是什么了，就是以前读一些当代作家的小说（如余华的活着）之后的那种窒息难过，好像共情了，但是远远达不到那种情感深度，他们写的都是受尽苦难的人，他们也乐观坚强他们也接受命运，我只能说这都是好故事，但是我除了感到难过和无助，并不能得到力量。,0,0
,4795644219492699,Wed Jul 27 00:49:03 +0800 2022,YSternpccccc,https://weibo.com//u/5847679447,还是根本理解不了怎么治好精神内耗的。这个社会真就自私到这个地步了吗，这种事看完如果内心有一点触动难道不是难过感动和同情吗，为什么会获得这种平静啊，他人之苦什么时候会变成治愈自己的药了，他二舅可能一辈子自得其乐了，但客观讲他还是很苦非常苦。怎么会想从他人的苦痛中去寻求自我精神和解呢,1,0
