parent_comment_id,comment_id,comment_time,comment_user_name,comment_user_link,comment_content,comment_like_num,child_comment_num
,4795868915434940,Wed Jul 27 15:41:55 +0800 2022,荷色的梦,https://weibo.com//u/5251467388,把所有苦难都推卸给时代去进行反思，把责任庞大化虚无化，最后故作姿态叹息一声“中国人就是喜欢看人吃苦”，这种反思比起真真切切的坚韧，只能说懦弱又卑怯，反思了个寂寞,1,0
,4795873382894071,Wed Jul 27 15:59:40 +0800 2022,荷色的梦,https://weibo.com//u/5251467388,图片评论 ,0,0
,4795873147490587,Wed Jul 27 15:58:44 +0800 2022,荷色的梦,https://weibo.com//u/5251467388,世上绝大多数人想要的人生都不是自己现在的人生，倘若如此便说世上所有人都过的悲愤痛苦，也太人类共同体了。明知现实如此，排除万难争取胜利，坚韧不屈反而成了无奈软弱，安稳乡呆久了，脑子都麻了，说的苦难都轻而易举了，不知道是城市社会的成功还是悲哀,0,0
,4795869292923144,Wed Jul 27 15:43:25 +0800 2022,荷色的梦,https://weibo.com//u/5251467388,简中新媒体：新闻——大家要反思啊！——大家别反思了！——大家应该反思！——互喷——忘的一干二净,0,0
,4795868034629886,Wed Jul 27 15:38:24 +0800 2022,荷色的梦,https://weibo.com//u/5251467388,"看到一个新闻就要求反思，不知道的以为欠了全世界<img alt=""[哆啦A梦吃惊]"" title=""[哆啦A梦吃惊]"" src=""https://face.t.sinajs.cn/t4/appstyle/expression/ext/normal/f0/dorachijing_org.gif"" />",0,0
