parent_comment_id,comment_id,comment_time,comment_user_name,comment_user_link,comment_content,comment_like_num,child_comment_num
,4796540185477287,Fri Jul 29 12:09:17 +0800 2022,LittlePuppyo,https://weibo.com//u/3644559477,而且我觉得这件事没必要大范围讨论…这样的案例在中国乡村不胜枚举（？）,0,4
4796540185477287.0,4796582220531872,Fri Jul 29 14:56:20 +0800 2022,你老这么想我也没有办法,https://weibo.com//u/7660927500,回复<a href=/n/LittlePuppyo>@LittlePuppyo</a>:(〃￣︶￣)人(￣︶￣〃),0,0
4796540185477287.0,4796568966013257,Fri Jul 29 14:03:40 +0800 2022,LittlePuppyo,https://weibo.com//u/3644559477,回复<a href=/n/你老这么想我也没有办法>@你老这么想我也没有办法</a>:确实，认知不同 每个人看到所联想的情况不同…苦难和穷病治不好。二舅是聪明人，甚至于天才了，他做到了逻辑自洽，但不代表他经历的不是苦难,0,0
4796540185477287.0,4796566018198326,Fri Jul 29 13:51:57 +0800 2022,你老这么想我也没有办法,https://weibo.com//u/7660927500,咱应该反思造就成这样苦难的源头，而不是赞美，其实二舅这种逆来顺受的一生，说难听点就和牲口一样在接受着不被掌控的幸运和不幸,0,0
4796540185477287.0,4796565359692693,Fri Jul 29 13:49:20 +0800 2022,你老这么想我也没有办法,https://weibo.com//u/7660927500,这件事其实应该在另一方面更深层次地讨论，为什么媒体和大众舆论都是在怂恿我们要心甘情愿承受苦难与逆来顺受，以及你说的造成中国乡村这种遭遇和苦难的内在起因,0,0
,4796532882931949,Fri Jul 29 11:40:16 +0800 2022,株洲向上好青年,https://weibo.com//u/6113255915,"因为这样能让社会稳定啊<img alt=""[doge]"" title=""[doge]"" src=""https://face.t.sinajs.cn/t4/appstyle/expression/ext/normal/a1/2018new_doge02_org.png"" />",0,0
